{
  "schema_version": "1.0",
  "assessment_id": "h3fast-phase0-formal-quality-metric-selection-v1",
  "status": "candidate-review",
  "updated_at": "2026-08-18",
  "source_issue": "https://github.com/nishide-dev/h3fast/issues/16",
  "metrics": [
    {
      "family": "prompt-adherence",
      "disposition": "candidate",
      "research_owner": "nishide-dev",
      "proposed_method": "Encode the prompt and uniformly sampled candidate frames with SigLIP2, then aggregate per-frame cosine similarity without substituting this score for the other metric families.",
      "external_components": [
        {
          "name": "google/siglip2-base-patch16-256",
          "kind": "model",
          "version": "2026-08-16-snapshot",
          "revision": "3f9f96cb90da5dbc758b01813f2f6f1aee24c1ab",
          "source": "https://huggingface.co/google/siglip2-base-patch16-256/tree/3f9f96cb90da5dbc758b01813f2f6f1aee24c1ab",
          "license": "Apache-2.0",
          "license_scope": "Model repository metadata and files at the pinned revision"
        },
        {
          "name": "transformers",
          "kind": "source",
          "version": "5.14.1",
          "revision": "a08ace4bbd97e721c98751deec37d87b026acadc",
          "source": "https://github.com/huggingface/transformers/tree/a08ace4bbd97e721c98751deec37d87b026acadc",
          "license": "Apache-2.0",
          "license_scope": "Source code at the pinned release tag"
        }
      ],
      "inputs": [
        "prompt",
        "candidate-video"
      ],
      "score_direction": "higher-is-better",
      "adoption_requirements": [
        "Implement an H3Fast adapter with fixed frame sampling, RGB conversion, text preprocessing, and aggregation semantics.",
        "Verify Python 3.12, pinned PyTorch, GPU memory, offline snapshot loading, and clean-wheel behavior.",
        "Measure fixed-baseline self-variation on all 60 formal cases before assigning a budget."
      ],
      "blockers": [
        "No baseline self-variation or quality-owner approval evidence exists."
      ],
      "sources": [
        "https://huggingface.co/google/siglip2-base-patch16-256/tree/3f9f96cb90da5dbc758b01813f2f6f1aee24c1ab",
        "https://huggingface.co/docs/transformers/model_doc/siglip2",
        "https://github.com/huggingface/transformers/tree/a08ace4bbd97e721c98751deec37d87b026acadc"
      ]
    },
    {
      "family": "perceptual-video",
      "disposition": "candidate",
      "research_owner": "nishide-dev",
      "proposed_method": "Compute LPIPS on corresponding decoded RGB frames for each baseline/candidate pairing and aggregate per-case distances without temporal resampling.",
      "external_components": [
        {
          "name": "LPIPS",
          "kind": "source",
          "version": "0.1.4",
          "revision": "082bb24f84c091ea94de2867d34c4544f68e0963",
          "source": "https://github.com/richzhang/PerceptualSimilarity/tree/082bb24f84c091ea94de2867d34c4544f68e0963",
          "license": "BSD-2-Clause",
          "license_scope": "Source code only. The BSD-2-Clause text covers the software and does not state terms for network weights; the AlexNet backbone is recorded as a separate component."
        },
        {
          "name": "torchvision alexnet-owt-7be5be79.pth",
          "kind": "model",
          "version": "0.26.0",
          "revision": "7be5be791159472b1fbf3c69796f7cb30dca7ad8466c2df70058c37116cdee02",
          "source": "https://download.pytorch.org/models/alexnet-owt-7be5be79.pth",
          "license": "unconfirmed",
          "license_scope": "torchvision source is BSD-3-Clause, but that LICENSE text covers software only and does not state terms for distributed pretrained checkpoints; upstream pytorch/vision#160 raised the same question and no license statement for the weights was found. Treat the checkpoint as unlicensed for redistribution: local digest-pinned use only, never bundled into a wheel, image, or benchmark bundle."
        }
      ],
      "inputs": [
        "baseline-video",
        "candidate-video"
      ],
      "score_direction": "lower-is-better",
      "adoption_requirements": [
        "Implement deterministic matching of decoded frame count, timestamps, color conversion, and LPIPS input normalization.",
        "Verify bundled network-weight provenance and compatibility with the pinned PyTorch runtime.",
        "Measure fixed-baseline self-variation on all 60 formal cases before assigning a budget."
      ],
      "blockers": [
        "The AlexNet backbone checkpoint license and redistribution scope are unconfirmed; the digest-pinned file stays local-only.",
        "No baseline self-variation or quality-owner approval evidence exists."
      ],
      "sources": [
        "https://github.com/richzhang/PerceptualSimilarity/tree/082bb24f84c091ea94de2867d34c4544f68e0963",
        "https://pypi.org/project/lpips/0.1.4/",
        "https://download.pytorch.org/models/alexnet-owt-7be5be79.pth"
      ]
    },
    {
      "family": "temporal-consistency",
      "disposition": "candidate",
      "research_owner": "nishide-dev",
      "proposed_method": "Use an H3Fast-owned adapter to compare adjacent-frame LPIPS trajectories between baseline and candidate videos while retaining a separate perceptual-video result.",
      "external_components": [
        {
          "name": "LPIPS",
          "kind": "source",
          "version": "0.1.4",
          "revision": "082bb24f84c091ea94de2867d34c4544f68e0963",
          "source": "https://github.com/richzhang/PerceptualSimilarity/tree/082bb24f84c091ea94de2867d34c4544f68e0963",
          "license": "BSD-2-Clause",
          "license_scope": "Source code only. The BSD-2-Clause text covers the software and does not state terms for network weights; the AlexNet backbone is recorded as a separate component."
        },
        {
          "name": "torchvision alexnet-owt-7be5be79.pth",
          "kind": "model",
          "version": "0.26.0",
          "revision": "7be5be791159472b1fbf3c69796f7cb30dca7ad8466c2df70058c37116cdee02",
          "source": "https://download.pytorch.org/models/alexnet-owt-7be5be79.pth",
          "license": "unconfirmed",
          "license_scope": "torchvision source is BSD-3-Clause, but that LICENSE text covers software only and does not state terms for distributed pretrained checkpoints; upstream pytorch/vision#160 raised the same question and no license statement for the weights was found. Treat the checkpoint as unlicensed for redistribution: local digest-pinned use only, never bundled into a wheel, image, or benchmark bundle."
        }
      ],
      "inputs": [
        "baseline-video",
        "candidate-video"
      ],
      "score_direction": "lower-is-better",
      "adoption_requirements": [
        "Specify the adjacent-frame trajectory distance, timestamp alignment, scene-cut handling, and zero-motion boundary behavior.",
        "Add tests for static scenes, abrupt cuts, frame-count mismatch, non-finite values, and decode failure.",
        "Measure fixed-baseline self-variation on all 60 formal cases before assigning a budget."
      ],
      "blockers": [
        "The AlexNet backbone checkpoint license and redistribution scope are unconfirmed; the digest-pinned file stays local-only.",
        "No baseline self-variation or quality-owner approval evidence exists."
      ],
      "sources": [
        "https://github.com/richzhang/PerceptualSimilarity/tree/082bb24f84c091ea94de2867d34c4544f68e0963",
        "https://pypi.org/project/lpips/0.1.4/"
      ]
    },
    {
      "family": "audio-quality",
      "disposition": "blocked",
      "research_owner": "nishide-dev",
      "proposed_method": "Compare each candidate audio track with its paired baseline by using ViSQOL in full-reference audio mode with an explicit 48 kHz decode and channel policy.",
      "external_components": [
        {
          "name": "ViSQOL",
          "kind": "source",
          "version": "2026-08-16-revision",
          "revision": "38d0b0163e441047d4429bf07ad09e5b9031d02c",
          "source": "https://github.com/google/visqol/tree/38d0b0163e441047d4429bf07ad09e5b9031d02c",
          "license": "Apache-2.0",
          "license_scope": "Source code at the pinned revision"
        }
      ],
      "inputs": [
        "baseline-audio",
        "candidate-audio"
      ],
      "score_direction": "higher-is-better",
      "adoption_requirements": [
        "Build and smoke-test the pinned ViSQOL revision in the Python 3.12 fixed runtime.",
        "Fix sample-rate, channel, duration alignment, silence, and missing-audio semantics in an H3Fast adapter.",
        "Measure fixed-baseline self-variation on all applicable formal cases and define fail-closed handling for silent cases."
      ],
      "blockers": [
        "The Bazel/native build and Python 3.12 integration have not been verified in the fixed H3 runtime.",
        "No H3Fast metric entrypoint, media adapter, or correctness test exists.",
        "No baseline self-variation or quality-owner approval evidence exists."
      ],
      "sources": [
        "https://github.com/google/visqol/tree/38d0b0163e441047d4429bf07ad09e5b9031d02c",
        "https://github.com/google/visqol/blob/38d0b0163e441047d4429bf07ad09e5b9031d02c/README.md"
      ]
    },
    {
      "family": "av-sync",
      "disposition": "blocked",
      "research_owner": "nishide-dev",
      "proposed_method": "Estimate temporal audio/video offset independently for baseline and candidate media with Synchformer, then compare offset error without treating visual quality as a substitute.",
      "external_components": [
        {
          "name": "Synchformer",
          "kind": "source",
          "version": "2026-08-16-revision",
          "revision": "b66668a1521d7567cc760e5544b2b5b53179b687",
          "source": "https://github.com/v-iashin/Synchformer/tree/b66668a1521d7567cc760e5544b2b5b53179b687",
          "license": "MIT",